
Bus 002 Device 003: ID 1b1c:1c0b Corsair 
Device Descriptor:
  bLength                18
  bDescriptorType         1
  bcdUSB               2.00
  bDeviceClass            0 (Defined at Interface level)
  bDeviceSubClass         0 
  bDeviceProtocol         0 
  bMaxPacketSize0         8
  idVendor           0x1b1c Corsair
  idProduct          0x1c0b 
  bcdDevice            0.02
  iManufacturer           1                          
  iProduct                2                       
  iSerial                 0 
  bNumConfigurations      1
  Configuration Descriptor:
    bLength                 9
    bDescriptorType         2
    wTotalLength           41
    bNumInterfaces          1
    bConfigurationValue     1
    iConfiguration          0 
    bmAttributes         0xc0
      Self Powered
    MaxPower              100mA
    Interface Descriptor:
      bLength                 9
      bDescriptorType         4
      bInterfaceNumber        0
      bAlternateSetting       0
      bNumEndpoints           2
      bInterfaceClass         3 Human Interface Device
      bInterfaceSubClass      0 No Subclass
      bInterfaceProtocol      0 None
      iInterface              0 
        HID Device Descriptor:
          bLength                 9
          bDescriptorType        33
          bcdHID               1.11
          bCountryCode            0 Not supported
          bNumDescriptors         1
          bDescriptorType        34 Report
          wDescriptorLength      28
          Report Descriptor: (length is 28)
            Item(Global): Usage Page, data= [ 0x00 0xff ] 65280
                            (null)
            Item(Local ): Usage, data= [ 0x01 ] 1
                            (null)
            Item(Main  ): Collection, data= [ 0x01 ] 1
                            Application
            Item(Local ): Usage Minimum, data= [ 0x01 ] 1
                            (null)
            Item(Local ): Usage Maximum, data= [ 0x40 ] 64
                            (null)
            Item(Global): Logical Minimum, data= [ 0x01 ] 1
            Item(Global): Logical Maximum, data= [ 0x40 ] 64
            Item(Global): Report Size, data= [ 0x08 ] 8
            Item(Global): Report Count, data= [ 0x40 ] 64
            Item(Main  ): Input, data= [ 0x00 ] 0
                            Data Array Absolute No_Wrap Linear
                            Preferred_State No_Null_Position Non_Volatile Bitfield
            Item(Local ): Usage Minimum, data= [ 0x01 ] 1
                            (null)
            Item(Local ): Usage Maximum, data= [ 0x40 ] 64
                            (null)
            Item(Main  ): Output, data= [ 0x00 ] 0
                            Data Array Absolute No_Wrap Linear
                            Preferred_State No_Null_Position Non_Volatile Bitfield
            Item(Main  ): End Collection, data=none
      Endpoint Descriptor:
        bLength                 7
        bDescriptorType         5
        bEndpointAddress     0x81  EP 1 IN
        bmAttributes            3
          Transfer Type            Interrupt
          Synch Type               None
          Usage Type               Data
        wMaxPacketSize     0x0040  1x 64 bytes
        bInterval               1
      Endpoint Descriptor:
        bLength                 7
        bDescriptorType         5
        bEndpointAddress     0x01  EP 1 OUT
        bmAttributes            3
          Transfer Type            Interrupt
          Synch Type               None
          Usage Type               Data
        wMaxPacketSize     0x0040  1x 64 bytes
        bInterval               1
Device Status:     0x0001
  Self Powered
